{
  "meta": {
    "id": "81a55b1c-46d9-4190-8c4f-3b7f2600024e",
    "name": "generated_42",
    "seed": 42,
    "created_at": "2026-04-19T14:23:01.775193+00:00",
    "version": "1.0"
  },
  "grid": {
    "width": 15,
    "height": 15,
    "cells": [
      {
        "id": "0,0",
        "x": 0,
        "y": 0,
        "type": "road",
        "cost": 1,
        "passable": true,
        "label": null,
        "metadata": {}
      },
      {
        "id": "1,0",
        "x": 1,
        "y": 0,
        "type": "road",
        "cost": 1,
        "passable": true,
        "label": null,
        "metadata": {}
      },
      {
        "id": "2,0",
        "x": 2,
        "y": 0,
        "type": "obstacle",
        "cost": null,
        "passable": false,
        "label": null,
        "metadata": {}
      },
      {
        "id": "3,0",
        "x": 3,
        "y": 0,
        "type": "traffic_zone",
        "cost": 10,
        "passable": true,
        "label": null,
        "metadata": {}
      },
      {
        "id": "4,0",
        "x": 4,
        "y": 0,
        "type": "traffic_zone",
        "cost": 10,
        "passable": true,
        "label": null,
        "metadata": {}
      },
      {
        "id": "5,0",
        "x": 5,
        "y": 0,
        "type": "traffic_zone",
        "cost": 10,
        "passable": true,
        "label": null,
        "metadata": {}
      },
      {
        "id": "6,0",
        "x": 6,
        "y": 0,
        "type": "road",
        "cost": 1,
        "passable": true,
        "label": null,
        "metadata": {}
      },
      {
        "id": "7,0",
        "x": 7,
        "y": 0,
        "type": "road",
        "cost": 1,
        "passable": true,
        "label": null,
        "metadata": {}
      },
      {
        "id": "8,0",
        "x": 8,
        "y": 0,
        "type": "road",
        "cost": 1,
        "passable": true,
        "label": null,
        "metadata": {}
      },
      {
        "id": "9,0",
        "x": 9,
        "y": 0,
        "type": "road",
        "cost": 1,
        "passable": true,
        "label": null,
        "metadata": {}
      },
      {
        "id": "10,0",
        "x": 10,
        "y": 0,
        "type": "road",
        "cost": 1,
        "passable": true,
        "label": null,
        "metadata": {}
      },
      {
        "id": "11,0",
        "x": 11,
        "y": 0,
        "type": "road",
        "cost": 1,
        "passable": true,
        "label": null,
        "metadata": {}
      },
      {
        "id": "12,0",
        "x": 12,
        "y": 0,
        "type": "road",
        "cost": 1,
        "passable": true,
        "label": null,
        "metadata": {}
      },
      {
        "id": "13,0",
        "x": 13,
        "y": 0,
        "type": "road",
        "cost": 1,
        "passable": true,
        "label": null,
        "metadata": {}
      },
      {
        "id": "14,0",
        "x": 14,
        "y": 0,
        "type": "road",
        "cost": 1,
        "passable": true,
        "label": null,
        "metadata": {}
      },
      {
        "id": "0,1",
        "x": 0,
        "y": 1,
        "type": "traffic_zone",
        "cost": 10,
        "passable": true,
        "label": null,
        "metadata": {}
      },
      {
        "id": "1,1",
        "x": 1,
        "y": 1,
        "type": "road",
        "cost": 1,
        "passable": true,
        "label": null,
        "metadata": {}
      },
      {
        "id": "2,1",
        "x": 2,
        "y": 1,
        "type": "road",
        "cost": 1,
        "passable": true,
        "label": null,
        "metadata": {}
      },
      {
        "id": "3,1",
        "x": 3,
        "y": 1,
        "type": "road",
        "cost": 1,
        "passable": true,
        "label": null,
        "metadata": {}
      },
      {
        "id": "4,1",
        "x": 4,
        "y": 1,
        "type": "road",
        "cost": 1,
        "passable": true,
        "label": null,
        "metadata": {}
      },
      {
        "id": "5,1",
        "x": 5,
        "y": 1,
        "type": "road",
        "cost": 1,
        "passable": true,
        "label": null,
        "metadata": {}
      },
      {
        "id": "6,1",
        "x": 6,
        "y": 1,
        "type": "traffic_zone",
        "cost": 10,
        "passable": true,
        "label": null,
        "metadata": {}
      },
      {
        "id": "7,1",
        "x": 7,
        "y": 1,
        "type": "road",
        "cost": 1,
        "passable": true,
        "label": null,
        "metadata": {}
      },
      {
        "id": "8,1",
        "x": 8,
        "y": 1,
        "type": "road",
        "cost": 1,
        "passable": true,
        "label": null,
        "metadata": {}
      },
      {
        "id": "9,1",
        "x": 9,
        "y": 1,
        "type": "road",
        "cost": 1,
        "passable": true,
        "label": null,
        "metadata": {}
      },
      {
        "id": "10,1",
        "x": 10,
        "y": 1,
        "type": "road",
        "cost": 1,
        "passable": true,
        "label": null,
        "metadata": {}
      },
      {
        "id": "11,1",
        "x": 11,
        "y": 1,
        "type": "road",
        "cost": 1,
        "passable": true,
        "label": null,
        "metadata": {}
      },
      {
        "id": "12,1",
        "x": 12,
        "y": 1,
        "type": "road",
        "cost": 1,
        "passable": true,
        "label": null,
        "metadata": {}
      },
      {
        "id": "13,1",
        "x": 13,
        "y": 1,
        "type": "road",
        "cost": 1,
        "passable": true,
        "label": null,
        "metadata": {}
      },
      {
        "id": "14,1",
        "x": 14,
        "y": 1,
        "type": "traffic_zone",
        "cost": 10,
        "passable": true,
        "label": null,
        "metadata": {}
      },
      {
        "id": "0,2",
        "x": 0,
        "y": 2,
        "type": "obstacle",
        "cost": null,
        "passable": false,
        "label": null,
        "metadata": {}
      },
      {
        "id": "1,2",
        "x": 1,
        "y": 2,
        "type": "road",
        "cost": 1,
        "passable": true,
        "label": null,
        "metadata": {}
      },
      {
        "id": "2,2",
        "x": 2,
        "y": 2,
        "type": "road",
        "cost": 1,
        "passable": true,
        "label": null,
        "metadata": {}
      },
      {
        "id": "3,2",
        "x": 3,
        "y": 2,
        "type": "road",
        "cost": 1,
        "passable": true,
        "label": null,
        "metadata": {}
      },
      {
        "id": "4,2",
        "x": 4,
        "y": 2,
        "type": "road",
        "cost": 1,
        "passable": true,
        "label": null,
        "metadata": {}
      },
      {
        "id": "5,2",
        "x": 5,
        "y": 2,
        "type": "road",
        "cost": 1,
        "passable": true,
        "label": null,
        "metadata": {}
      },
      {
        "id": "6,2",
        "x": 6,
        "y": 2,
        "type": "traffic_zone",
        "cost": 10,
        "passable": true,
        "label": null,
        "metadata": {}
      },
      {
        "id": "7,2",
        "x": 7,
        "y": 2,
        "type": "road",
        "cost": 1,
        "passable": true,
        "label": null,
        "metadata": {}
      },
      {
        "id": "8,2",
        "x": 8,
        "y": 2,
        "type": "road",
        "cost": 1,
        "passable": true,
        "label": null,
        "metadata": {}
      },
      {
        "id": "9,2",
        "x": 9,
        "y": 2,
        "type": "road",
        "cost": 1,
        "passable": true,
        "label": null,
        "metadata": {}
      },
      {
        "id": "10,2",
        "x": 10,
        "y": 2,
        "type": "road",
        "cost": 1,
        "passable": true,
        "label": null,
        "metadata": {}
      },
      {
        "id": "11,2",
        "x": 11,
        "y": 2,
        "type": "road",
        "cost": 1,
        "passable": true,
        "label": null,
        "metadata": {}
      },
      {
        "id": "12,2",
        "x": 12,
        "y": 2,
        "type": "delivery_point",
        "cost": 1,
        "passable": true,
        "label": null,
        "metadata": {}
      },
      {
        "id": "13,2",
        "x": 13,
        "y": 2,
        "type": "road",
        "cost": 1,
        "passable": true,
        "label": null,
        "metadata": {}
      },
      {
        "id": "14,2",
        "x": 14,
        "y": 2,
        "type": "traffic_zone",
        "cost": 10,
        "passable": true,
        "label": null,
        "metadata": {}
      },
      {
        "id": "0,3",
        "x": 0,
        "y": 3,
        "type": "obstacle",
        "cost": null,
        "passable": false,
        "label": null,
        "metadata": {}
      },
      {
        "id": "1,3",
        "x": 1,
        "y": 3,
        "type": "road",
        "cost": 1,
        "passable": true,
        "label": null,
        "metadata": {}
      },
      {
        "id": "2,3",
        "x": 2,
        "y": 3,
        "type": "obstacle",
        "cost": null,
        "passable": false,
        "label": null,
        "metadata": {}
      },
      {
        "id": "3,3",
        "x": 3,
        "y": 3,
        "type": "road",
        "cost": 1,
        "passable": true,
        "label": null,
        "metadata": {}
      },
      {
        "id": "4,3",
        "x": 4,
        "y": 3,
        "type": "road",
        "cost": 1,
        "passable": true,
        "label": null,
        "metadata": {}
      },
      {
        "id": "5,3",
        "x": 5,
        "y": 3,
        "type": "road",
        "cost": 1,
        "passable": true,
        "label": null,
        "metadata": {}
      },
      {
        "id": "6,3",
        "x": 6,
        "y": 3,
        "type": "road",
        "cost": 1,
        "passable": true,
        "label": null,